{
  "synthetic": true,
  "tolerance": 0.01,
  "captured_at": "2026-09-28T13:00:00Z",
  "calculator": "tools/canvas-synth/canvas_synth/gradecalc.py (port of canvas-lms lib/grade_calculator.rb @ 1c9f0bb)",
  "scenarios": {
    "weighted-groups": {
      "course_id": "58000",
      "course_code": "SCN 101",
      "name": "Scenario: Weighted Groups",
      "apply_assignment_group_weights": true,
      "weighted_grading_periods": false,
      "hide_final_grades": false,
      "visible_in_api": true,
      "grading_standard_id": "0",
      "grading_scheme": [
        [
          "A",
          0.94
        ],
        [
          "A-",
          0.9
        ],
        [
          "B+",
          0.87
        ],
        [
          "B",
          0.84
        ],
        [
          "B-",
          0.8
        ],
        [
          "C+",
          0.77
        ],
        [
          "C",
          0.74
        ],
        [
          "C-",
          0.7
        ],
        [
          "D+",
          0.67
        ],
        [
          "D",
          0.64
        ],
        [
          "D-",
          0.61
        ],
        [
          "F",
          0.0
        ]
      ],
      "current_score": 88.11,
      "final_score": 57.0,
      "current_grade": "B+",
      "final_grade": "F",
      "unposted_current_score": 88.11,
      "unposted_final_score": 57.0,
      "current_grading_period_id": null,
      "grading_periods": [],
      "assignment_groups": [
        {
          "id": "199000",
          "name": "Homework",
          "group_weight": 40.0,
          "current": {
            "score": 54.5,
            "possible": 60.0,
            "grade": 90.83,
            "dropped_submission_ids": []
          },
          "final": {
            "score": 54.5,
            "possible": 80.0,
            "grade": 68.13,
            "dropped_submission_ids": []
          }
        },
        {
          "id": "199001",
          "name": "Quizzes",
          "group_weight": 35.0,
          "current": {
            "score": 85.0,
            "possible": 100.0,
            "grade": 85.0,
            "dropped_submission_ids": []
          },
          "final": {
            "score": 85.0,
            "possible": 100.0,
            "grade": 85.0,
            "dropped_submission_ids": []
          }
        },
        {
          "id": "199002",
          "name": "Final",
          "group_weight": 25.0,
          "current": {
            "score": 0.0,
            "possible": 0.0,
            "grade": null,
            "dropped_submission_ids": []
          },
          "final": {
            "score": 0.0,
            "possible": 100.0,
            "grade": 0.0,
            "dropped_submission_ids": []
          }
        }
      ],
      "design_target_current_score": null,
      "notes": null
    },
    "unweighted-groups": {
      "course_id": "58000",
      "course_code": "SCN 102",
      "name": "Scenario: Points",
      "apply_assignment_group_weights": false,
      "weighted_grading_periods": false,
      "hide_final_grades": false,
      "visible_in_api": true,
      "grading_standard_id": "0",
      "grading_scheme": [
        [
          "A",
          0.94
        ],
        [
          "A-",
          0.9
        ],
        [
          "B+",
          0.87
        ],
        [
          "B",
          0.84
        ],
        [
          "B-",
          0.8
        ],
        [
          "C+",
          0.77
        ],
        [
          "C",
          0.74
        ],
        [
          "C-",
          0.7
        ],
        [
          "D+",
          0.67
        ],
        [
          "D",
          0.64
        ],
        [
          "D-",
          0.61
        ],
        [
          "F",
          0.0
        ]
      ],
      "current_score": 55.99,
      "final_score": 12.38,
      "current_grade": "F",
      "final_grade": "F",
      "unposted_current_score": 55.99,
      "unposted_final_score": 12.38,
      "current_grading_period_id": null,
      "grading_periods": [],
      "assignment_groups": [
        {
          "id": "199000",
          "name": "Assignments",
          "group_weight": 0.0,
          "current": {
            "score": 142.0,
            "possible": 191.0,
            "grade": 74.35,
            "dropped_submission_ids": []
          },
          "final": {
            "score": 142.0,
            "possible": 191.0,
            "grade": 74.35,
            "dropped_submission_ids": []
          }
        },
        {
          "id": "199001",
          "name": "Exams",
          "group_weight": 0.0,
          "current": {
            "score": 17.0,
            "possible": 93.0,
            "grade": 18.28,
            "dropped_submission_ids": []
          },
          "final": {
            "score": 17.0,
            "possible": 1093.0,
            "grade": 1.56,
            "dropped_submission_ids": []
          }
        }
      ],
      "design_target_current_score": null,
      "notes": null
    },
    "drop-lowest": {
      "course_id": "58000",
      "course_code": "SCN 103",
      "name": "Scenario: Drop Lowest",
      "apply_assignment_group_weights": false,
      "weighted_grading_periods": false,
      "hide_final_grades": false,
      "visible_in_api": true,
      "grading_standard_id": "0",
      "grading_scheme": [
        [
          "A",
          0.94
        ],
        [
          "A-",
          0.9
        ],
        [
          "B+",
          0.87
        ],
        [
          "B",
          0.84
        ],
        [
          "B-",
          0.8
        ],
        [
          "C+",
          0.77
        ],
        [
          "C",
          0.74
        ],
        [
          "C-",
          0.7
        ],
        [
          "D+",
          0.67
        ],
        [
          "D",
          0.64
        ],
        [
          "D-",
          0.61
        ],
        [
          "F",
          0.0
        ]
      ],
      "current_score": 74.64,
      "final_score": 63.41,
      "current_grade": "C",
      "final_grade": "D-",
      "unposted_current_score": 74.64,
      "unposted_final_score": 63.41,
      "current_grading_period_id": null,
      "grading_periods": [],
      "assignment_groups": [
        {
          "id": "199000",
          "name": "Labs",
          "group_weight": 0.0,
          "current": {
            "score": 103.0,
            "possible": 138.0,
            "grade": 74.64,
            "dropped_submission_ids": [
              "990000066",
              "990000070"
            ]
          },
          "final": {
            "score": 156.0,
            "possible": 246.0,
            "grade": 63.41,
            "dropped_submission_ids": [
              "990000082"
            ]
          }
        }
      ],
      "design_target_current_score": null,
      "notes": null
    },
    "drop-highest": {
      "course_id": "58000",
      "course_code": "SCN 104",
      "name": "Scenario: Drop Highest",
      "apply_assignment_group_weights": false,
      "weighted_grading_periods": false,
      "hide_final_grades": false,
      "visible_in_api": true,
      "grading_standard_id": "0",
      "grading_scheme": [
        [
          "A",
          0.94
        ],
        [
          "A-",
          0.9
        ],
        [
          "B+",
          0.87
        ],
        [
          "B",
          0.84
        ],
        [
          "B-",
          0.8
        ],
        [
          "C+",
          0.77
        ],
        [
          "C",
          0.74
        ],
        [
          "C-",
          0.7
        ],
        [
          "D+",
          0.67
        ],
        [
          "D",
          0.64
        ],
        [
          "D-",
          0.61
        ],
        [
          "F",
          0.0
        ]
      ],
      "current_score": 67.65,
      "final_score": 67.65,
      "current_grade": "D+",
      "final_grade": "D+",
      "unposted_current_score": 67.65,
      "unposted_final_score": 67.65,
      "current_grading_period_id": null,
      "grading_periods": [],
      "assignment_groups": [
        {
          "id": "199000",
          "name": "Quizzes",
          "group_weight": 0.0,
          "current": {
            "score": 23.0,
            "possible": 34.0,
            "grade": 67.65,
            "dropped_submission_ids": [
              "990000000"
            ]
          },
          "final": {
            "score": 23.0,
            "possible": 34.0,
            "grade": 67.65,
            "dropped_submission_ids": [
              "990000000"
            ]
          }
        }
      ],
      "design_target_current_score": null,
      "notes": null
    },
    "never-drop": {
      "course_id": "58000",
      "course_code": "SCN 105",
      "name": "Scenario: Never Drop",
      "apply_assignment_group_weights": false,
      "weighted_grading_periods": false,
      "hide_final_grades": false,
      "visible_in_api": true,
      "grading_standard_id": "0",
      "grading_scheme": [
        [
          "A",
          0.94
        ],
        [
          "A-",
          0.9
        ],
        [
          "B+",
          0.87
        ],
        [
          "B",
          0.84
        ],
        [
          "B-",
          0.8
        ],
        [
          "C+",
          0.77
        ],
        [
          "C",
          0.74
        ],
        [
          "C-",
          0.7
        ],
        [
          "D+",
          0.67
        ],
        [
          "D",
          0.64
        ],
        [
          "D-",
          0.61
        ],
        [
          "F",
          0.0
        ]
      ],
      "current_score": 76.67,
      "final_score": 76.67,
      "current_grade": "C",
      "final_grade": "C",
      "unposted_current_score": 76.67,
      "unposted_final_score": 76.67,
      "current_grading_period_id": null,
      "grading_periods": [],
      "assignment_groups": [
        {
          "id": "199000",